{
  "$schema": "http://json-schema.org/draft-07/schema#",
  "type": "object",
  "properties": {
    "incident_date": {
      "type": "string",
      "format": "date"
    },
    "incident_type": {
      "type": "string",
      "enum": [
        "fire",
        "theft",
        "accident",
        "flood",
        "other"
      ]
    },
    "location": {
      "type": "object",
      "properties": {
        "street_address": {
          "type": "string"
        },
        "city": {
          "type": "string"
        },
        "state": {
          "type": "string"
        },
        "zip_code": {
          "type": "string"
        }
      },
      "additionalProperties": false
    },
    "estimated_damages": {
      "type": "number"
    },
    "police_report_filed": {
      "type": "boolean"
    },
    "witnesses": {
      "type": "array",
      "items": {
        "type": "object",
        "properties": {
          "name": {
            "type": "string"
          },
          "phone": {
            "type": "string"
          },
          "email": {
            "type": "string",
            "format": "email"
          }
        },
        "additionalProperties": false
      }
    }
  },
  "additionalProperties": false
}