[
  {
    "incident_date": "2023-11-15",
    "incident_type": "fire",
    "location": {
      "street_address": "742 Maple Grove",
      "city": "Burlington",
      "state": "Vermont",
      "zip_code": "05401"
    },
    "estimated_damages": 157000,
    "police_report_filed": true,
    "witnesses": [
      {
        "name": "Marcus Chen",
        "phone": "802-555-0123",
        "email": "mchen@vermontu.edu"
      },
      {
        "name": "Sarah O'Brien",
        "phone": "802-555-0145",
        "email": "sarahob@gmail.com"
      }
    ]
  },
  {
    "incident_date": "2023-10-01",
    "incident_type": "theft",
    "location": {
      "street_address": "1584 Pine Street",
      "city": "Seattle",
      "state": "Washington",
      "zip_code": "98101"
    },
    "estimated_damages": 0,
    "police_report_filed": true,
    "witnesses": []
  },
  {
    "incident_date": "2023-10-28",
    "incident_type": "accident",
    "location": {
      "street_address": "",
      "city": "",
      "state": "",
      "zip_code": ""
    },
    "estimated_damages": 3200,
    "police_report_filed": false,
    "witnesses": [
      {
        "name": "David Thompson",
        "phone": "206-555-9876",
        "email": ""
      }
    ]
  },
  {
    "incident_date": "2023-09-12",
    "incident_type": "flood",
    "location": {
      "street_address": "",
      "city": "Houston",
      "state": "Texas",
      "zip_code": "77002"
    },
    "estimated_damages": 0,
    "police_report_filed": false,
    "witnesses": []
  },
  {
    "incident_date": "2023-10-01",
    "incident_type": "other",
    "location": {
      "street_address": "123 Main St",
      "city": "Anytown",
      "state": "CA",
      "zip_code": "90210"
    },
    "estimated_damages": 12400,
    "police_report_filed": false,
    "witnesses": []
  },
  {
    "incident_date": "2023-10-01",
    "incident_type": "fire",
    "location": {
      "street_address": "935 Oak Lane",
      "city": "Sacramento",
      "state": "California",
      "zip_code": "95814"
    },
    "estimated_damages": 45600,
    "police_report_filed": false,
    "witnesses": []
  },
  {
    "incident_date": "2023-11-02",
    "incident_type": "theft",
    "location": {
      "street_address": "467 Elm Street",
      "city": "Chicago",
      "state": "IL",
      "zip_code": "60601"
    },
    "estimated_damages": 8900,
    "police_report_filed": true,
    "witnesses": []
  },
  {
    "incident_date": "2023-10-15",
    "incident_type": "accident",
    "location": {
      "street_address": "",
      "city": "Miami",
      "state": "Florida",
      "zip_code": ""
    },
    "estimated_damages": 0,
    "police_report_filed": false,
    "witnesses": [
      {
        "name": "Maria Rodriguez",
        "phone": "",
        "email": "mrodriguez@yahoo.com"
      }
    ]
  },
  {
    "incident_date": "2023-10-01",
    "incident_type": "flood",
    "location": {
      "street_address": "123 Main St",
      "city": "Springfield",
      "state": "IL",
      "zip_code": "62701"
    },
    "estimated_damages": 89000,
    "police_report_filed": false,
    "witnesses": []
  },
  {
    "incident_date": "2023-11-01",
    "incident_type": "fire",
    "location": {
      "street_address": "my home",
      "city": "unknown",
      "state": "unknown",
      "zip_code": "unknown"
    },
    "estimated_damages": null,
    "police_report_filed": false,
    "witnesses": []
  },
  {
    "incident_date": "2023-10-30",
    "incident_type": "theft",
    "location": {
      "street_address": "",
      "city": "",
      "state": "",
      "zip_code": ""
    },
    "estimated_damages": 0,
    "police_report_filed": false,
    "witnesses": [
      {
        "name": "Emma Davis",
        "phone": "303-555-2345",
        "email": ""
      }
    ]
  },
  {
    "incident_date": "2023-10-01",
    "incident_type": "accident",
    "location": {
      "street_address": "123 Main St",
      "city": "Anytown",
      "state": "CA",
      "zip_code": "12345"
    },
    "estimated_damages": 5000,
    "police_report_filed": true,
    "witnesses": []
  },
  {
    "incident_date": "2023-10-10",
    "incident_type": "flood",
    "location": {
      "street_address": "892 Highland Ave",
      "city": "Atlanta",
      "state": "GA",
      "zip_code": "30308"
    },
    "estimated_damages": 0,
    "police_report_filed": false,
    "witnesses": []
  },
  {
    "incident_date": "2023-11-05",
    "incident_type": "fire",
    "location": {
      "street_address": "",
      "city": "",
      "state": "",
      "zip_code": ""
    },
    "estimated_damages": 0,
    "police_report_filed": false,
    "witnesses": [
      {
        "name": "Thomas Anderson",
        "phone": "415-555-8901",
        "email": "tanderson@gmail.com"
      }
    ]
  },
  {
    "incident_date": "2023-11-12",
    "incident_type": "theft",
    "location": {
      "street_address": "Not provided",
      "city": "Not provided",
      "state": "Not provided",
      "zip_code": "Not provided"
    },
    "estimated_damages": 5600,
    "police_report_filed": false,
    "witnesses": []
  },
  {
    "incident_date": "2023-10-25",
    "incident_type": "accident",
    "location": {
      "street_address": "",
      "city": "Phoenix",
      "state": "Arizona",
      "zip_code": ""
    },
    "estimated_damages": 4300,
    "police_report_filed": false,
    "witnesses": []
  },
  {
    "incident_date": "2023-10-01",
    "incident_type": "flood",
    "location": {
      "street_address": "123 Main St",
      "city": "Springfield",
      "state": "IL",
      "zip_code": "62701"
    },
    "estimated_damages": 15000,
    "police_report_filed": true,
    "witnesses": []
  },
  {
    "incident_date": "2023-11-14",
    "incident_type": "other",
    "location": {
      "street_address": "445 Mountain View",
      "city": "Denver",
      "state": "Colorado",
      "zip_code": "80202"
    },
    "estimated_damages": 9800,
    "police_report_filed": false,
    "witnesses": []
  }
]